14:25:30.456280 IP a23-46-57-32.deploy.static.akamaitechnologies.com.https > 172.16.1.226.55519: Flags [P.], seq 1230056777:1230056808, ack 1568035174, win 1006, options [nop,nop,TS val 276319536 ecr 915793075], length 31
14:25:30.456333 IP 172.16.1.226.55519 > a23-46-57-32.deploy.static.akamaitechnologies.com.https: Flags [.], ack 31, win 4095, options [nop,nop,TS val 915861766 ecr 276319536], length 0
14:25:30.456466 IP 172.16.1.226.55519 > a23-46-57-32.deploy.static.akamaitechnologies.com.https: Flags [P.], seq 1:32, ack 31, win 4096, options [nop,nop,TS val 915861766 ecr 276319536], length 31
14:25:30.457412 IP a23-46-57-32.deploy.static.akamaitechnologies.com.https > 172.16.1.226.55519: Flags [F.], seq 31, ack 1, win 1006, options [nop,nop,TS val 276319536 ecr 915793075], length 0
14:25:30.457462 IP 172.16.1.226.55519 > a23-46-57-32.deploy.static.akamaitechnologies.com.https: Flags [.], ack 32, win 4096, options [nop,nop,TS val 915861767 ecr 276319536], length 0
14:25:30.457731 IP 172.16.1.226.55519 > a23-46-57-32.deploy.static.akamaitechnologies.com.https: Flags [F.], seq 32, ack 32, win 4096, options [nop,nop,TS val 915861767 ecr 276319536], length 0
14:25:30.472392 IP a23-46-57-32.deploy.static.akamaitechnologies.com.https > 172.16.1.226.55519: Flags [R], seq 1230056809, win 0, length 0
14:25:30.474382 IP a23-46-57-32.deploy.static.akamaitechnologies.com.https > 172.16.1.226.55519: Flags [R], seq 1230056809, win 0, length 0
14:25:30.621236 IP 172.16.1.226.63748 > 172.16.1.1.domain: 35929+ PTR? 32.57.46.23.in-addr.arpa. (42)
14:25:30.874088 IP 172.16.1.1.domain > 172.16.1.226.63748: 35929 1/6/6 PTR a23-46-57-32.deploy.static.akamaitechnologies.com. (313)
14:25:30.875375 IP 172.16.1.226.64597 > 172.16.1.1.domain: 45632+ PTR? 226.1.16.172.in-addr.arpa. (43)
14:25:30.876815 IP 172.16.1.1.domain > 172.16.1.226.64597: 45632 NXDomain 0/0/0 (43)
14:25:31.883010 IP 172.16.1.226.60960 > 172.16.1.1.domain: 21132+ PTR? 1.1.16.172.in-addr.arpa. (41)
14:25:31.887415 IP 172.16.1.1.domain > 172.16.1.226.60960: 21132 NXDomain 0/0/0 (41)
14:25:38.821838 IP 172.16.1.226.55465 > nuq04s29-in-f5.1e100.net.https: Flags [P.], seq 776839757:776839803, ack 1018533202, win 4096, options [nop,nop,TS val 915870125 ecr 2874847261], length 46
14:25:38.821927 IP 172.16.1.226.55482 > 45.60.31.34.https: Flags [P.], seq 3447189271:3447189317, ack 1276228615, win 4096, options [nop,nop,TS val 915870125 ecr 1584964359], length 46
14:25:38.821961 IP 172.16.1.226.55465 > nuq04s29-in-f5.1e100.net.https: Flags [F.], seq 46, ack 1, win 4096, options [nop,nop,TS val 915870125 ecr 2874847261], length 0
14:25:38.822375 IP 172.16.1.226.55442 > pf-in-f189.1e100.net.https: Flags [P.], seq 4010664745:4010664791, ack 3369873712, win 4096, options [nop,nop,TS val 915870125 ecr 16446395], length 46
14:25:38.822401 IP 172.16.1.226.55482 > 45.60.31.34.https: Flags [F.], seq 46, ack 1, win 4096, options [nop,nop,TS val 915870125 ecr 1584964359], length 0
14:25:38.822798 IP 172.16.1.226.55442 > pf-in-f189.1e100.net.https: Flags [F.], seq 46, ack 1, win 4096, options [nop,nop,TS val 915870125 ecr 16446395], length 0
14:25:38.852728 IP 45.60.31.34.https > 172.16.1.226.55482: Flags [P.], seq 1:32, ack 47, win 260, options [nop,nop,TS val 1585019008 ecr 915870125], length 31
14:25:38.852807 IP 172.16.1.226.55482 > 45.60.31.34.https: Flags [R], seq 3447189318, win 0, length 0
14:25:38.855036 IP 45.60.31.34.https > 172.16.1.226.55482: Flags [F.], seq 32, ack 47, win 260, options [nop,nop,TS val 1585019008 ecr 915870125], length 0
14:25:38.855066 IP 172.16.1.226.55482 > 45.60.31.34.https: Flags [R], seq 3447189318, win 0, length 0
14:25:38.896168 IP 172.16.1.226.64239 > 172.16.1.1.domain: 511+ PTR? 5.192.58.216.in-addr.arpa. (43)
14:25:38.919947 IP nuq04s29-in-f5.1e100.net.https > 172.16.1.226.55465: Flags [.], ack 46, win 196, options [nop,nop,TS val 2875070001 ecr 915870125], length 0
14:25:38.923842 IP nuq04s29-in-f5.1e100.net.https > 172.16.1.226.55465: Flags [F.], seq 1, ack 47, win 196, options [nop,nop,TS val 2875070001 ecr 915870125], length 0
14:25:38.923919 IP 172.16.1.226.55465 > nuq04s29-in-f5.1e100.net.https: Flags [.], ack 2, win 4096, options [nop,nop,TS val 915870223 ecr 2875070001], length 0
14:25:38.926084 IP pf-in-f189.1e100.net.https > 172.16.1.226.55442: Flags [.], ack 46, win 234, options [nop,nop,TS val 16641109 ecr 915870125], length 0
14:25:38.926087 IP pf-in-f189.1e100.net.https > 172.16.1.226.55442: Flags [F.], seq 1, ack 47, win 234, options [nop,nop,TS val 16641109 ecr 915870125], length 0
14:25:38.926172 IP 172.16.1.226.55442 > pf-in-f189.1e100.net.https: Flags [.], ack 2, win 4096, options [nop,nop,TS val 915870225 ecr 16641109], length 0
14:25:38.926978 IP 172.16.1.1.domain > 172.16.1.226.64239: 511 1/6/5 PTR nuq04s29-in-f5.1e100.net. (278)
14:25:38.928117 IP 172.16.1.226.50127 > 172.16.1.1.domain: 43631+ PTR? 34.31.60.45.in-addr.arpa. (42)
14:25:38.944340 IP 172.16.1.1.domain > 172.16.1.226.50127: 43631 NXDomain 0/0/0 (42)
14:25:38.945678 IP 172.16.1.226.54621 > 172.16.1.1.domain: 40216+ PTR? 189.202.194.173.in-addr.arpa. (46)
14:25:38.976522 IP 172.16.1.1.domain > 172.16.1.226.54621: 40216 1/6/6 PTR pf-in-f189.1e100.net. (288)
14:25:42.675925 IP xx-fbcdn-shv-01-iad3.fbcdn.net.https > 172.16.1.226.55513: Flags [P.], seq 394483583:394483629, ack 3699413063, win 126, options [nop,nop,TS val 942574874 ecr 915809731], length 46
14:25:42.675961 IP 172.16.1.226.55513 > xx-fbcdn-shv-01-iad3.fbcdn.net.https: Flags [.], ack 46, win 4094, options [nop,nop,TS val 915873969 ecr 942574874], length 0
14:25:42.676119 IP 172.16.1.226.55513 > xx-fbcdn-shv-01-iad3.fbcdn.net.https: Flags [F.], seq 1, ack 46, win 4096, options [nop,nop,TS val 915873969 ecr 942574874], length 0
14:25:42.676282 IP xx-fbcdn-shv-01-iad3.fbcdn.net.https > 172.16.1.226.55513: Flags [P.], seq 46:77, ack 1, win 126, options [nop,nop,TS val 942574874 ecr 915809731], length 31
14:25:42.676295 IP 172.16.1.226.55513 > xx-fbcdn-shv-01-iad3.fbcdn.net.https: Flags [F.], seq 1, ack 77, win 4095, options [nop,nop,TS val 915873969 ecr 942574874], length 0
14:25:42.676377 IP 172.16.1.226.55513 > xx-fbcdn-shv-01-iad3.fbcdn.net.https: Flags [F.], seq 1, ack 77, win 4096, options [nop,nop,TS val 915873969 ecr 942574874], length 0
14:25:42.676382 IP 172.16.1.226.55513 > xx-fbcdn-shv-01-iad3.fbcdn.net.https: Flags [F.], seq 1, ack 77, win 4096, options [nop,nop,TS val 915873969 ecr 942574874], length 0
14:25:42.677556 IP xx-fbcdn-shv-01-iad3.fbcdn.net.https > 172.16.1.226.55513: Flags [F.], seq 77, ack 1, win 126, options [nop,nop,TS val 942574874 ecr 915809731], length 0
14:25:42.677576 IP 172.16.1.226.55513 > xx-fbcdn-shv-01-iad3.fbcdn.net.https: Flags [F.], seq 1, ack 78, win 4096, options [nop,nop,TS val 915873970 ecr 942574874], length 0
14:25:42.678821 IP xx-fbcdn-shv-01-iad3.fbcdn.net.https > 172.16.1.226.55513: Flags [F.], seq 77, ack 1, win 126, options [nop,nop,TS val 942574942 ecr 915809731], length 0
14:25:42.678844 IP 172.16.1.226.55513 > xx-fbcdn-shv-01-iad3.fbcdn.net.https: Flags [F.], seq 1, ack 78, win 4096, options [nop,nop,TS val 915873971 ecr 942574874], length 0
14:25:42.691153 IP xx-fbcdn-shv-01-iad3.fbcdn.net.https > 172.16.1.226.55513: Flags [.], ack 2, win 126, options [nop,nop,TS val 942574992 ecr 915873969], length 0
14:25:42.691573 IP xx-fbcdn-shv-01-iad3.fbcdn.net.https > 172.16.1.226.55513: Flags [.], ack 2, win 126, options [nop,nop,TS val 942574992 ecr 915873969], length 0
14:25:42.692468 IP xx-fbcdn-shv-01-iad3.fbcdn.net.https > 172.16.1.226.55513: Flags [.], ack 2, win 126, options [nop,nop,TS val 942574992 ecr 915873969], length 0
14:25:42.693694 IP xx-fbcdn-shv-01-iad3.fbcdn.net.https > 172.16.1.226.55513: Flags [.], ack 2, win 126, options [nop,nop,TS val 942574992 ecr 915873969], length 0
14:25:42.694007 IP xx-fbcdn-shv-01-iad3.fbcdn.net.https > 172.16.1.226.55513: Flags [.], ack 2, win 126, options [nop,nop,TS val 942574992 ecr 915873970], length 0
14:25:43.303244 IP edge-star-mini-shv-01-iad3.facebook.com.https > 172.16.1.226.55514: Flags [P.], seq 1676574045:1676574091, ack 2213252056, win 144, options [nop,nop,TS val 140842654 ecr 915811707], length 46
14:25:43.303299 IP 172.16.1.226.55514 > edge-star-mini-shv-01-iad3.facebook.com.https: Flags [.], ack 46, win 4094, options [nop,nop,TS val 915874592 ecr 140842654], length 0
14:25:43.303532 IP edge-star-mini-shv-01-iad3.facebook.com.https > 172.16.1.226.55514: Flags [P.], seq 46:77, ack 1, win 144, options [nop,nop,TS val 140842654 ecr 915811707], length 31
14:25:43.303584 IP 172.16.1.226.55514 > edge-star-mini-shv-01-iad3.facebook.com.https: Flags [.], ack 77, win 4095, options [nop,nop,TS val 915874592 ecr 140842654], length 0
14:25:43.303688 IP 172.16.1.226.55514 > edge-star-mini-shv-01-iad3.facebook.com.https: Flags [P.], seq 1:32, ack 77, win 4096, options [nop,nop,TS val 915874592 ecr 140842654], length 31
14:25:43.303744 IP 172.16.1.226.55514 > edge-star-mini-shv-01-iad3.facebook.com.https: Flags [F.], seq 32, ack 77, win 4096, options [nop,nop,TS val 915874592 ecr 140842654], length 0
14:25:43.304844 IP edge-star-mini-shv-01-iad3.facebook.com.https > 172.16.1.226.55514: Flags [F.], seq 77, ack 1, win 144, options [nop,nop,TS val 140842654 ecr 915811707], length 0
14:25:43.304880 IP 172.16.1.226.55514 > edge-star-mini-shv-01-iad3.facebook.com.https: Flags [F.], seq 32, ack 78, win 4096, options [nop,nop,TS val 915874593 ecr 140842654], length 0
14:25:43.337693 IP edge-star-mini-shv-01-iad3.facebook.com.https > 172.16.1.226.55514: Flags [R], seq 1676574123, win 0, length 0
14:25:43.421544 IP xx-fbcdn-shv-01-iad3.fbcdn.net.https > 172.16.1.226.55518: Flags [P.], seq 3690492903:3690492949, ack 3477868319, win 202, options [nop,nop,TS val 3639895444 ecr 915811281], length 46
14:25:43.421601 IP 172.16.1.226.55518 > xx-fbcdn-shv-01-iad3.fbcdn.net.https: Flags [.], ack 46, win 4094, options [nop,nop,TS val 915874708 ecr 3639895444], length 0
14:25:43.421942 IP 172.16.1.226.55518 > xx-fbcdn-shv-01-iad3.fbcdn.net.https: Flags [F.], seq 1, ack 46, win 4096, options [nop,nop,TS val 915874708 ecr 3639895444], length 0
14:25:43.422402 IP xx-fbcdn-shv-01-iad3.fbcdn.net.https > 172.16.1.226.55518: Flags [P.], seq 46:77, ack 1, win 202, options [nop,nop,TS val 3639895444 ecr 915811281], length 31
14:25:43.422451 IP 172.16.1.226.55518 > xx-fbcdn-shv-01-iad3.fbcdn.net.https: Flags [F.], seq 1, ack 77, win 4095, options [nop,nop,TS val 915874708 ecr 3639895444], length 0
14:25:43.422672 IP 172.16.1.226.55518 > xx-fbcdn-shv-01-iad3.fbcdn.net.https: Flags [F.], seq 1, ack 77, win 4096, options [nop,nop,TS val 915874709 ecr 3639895444], length 0
14:25:43.422688 IP 172.16.1.226.55518 > xx-fbcdn-shv-01-iad3.fbcdn.net.https: Flags [F.], seq 1, ack 77, win 4096, options [nop,nop,TS val 915874709 ecr 3639895444], length 0
14:25:43.423651 IP xx-fbcdn-shv-01-iad3.fbcdn.net.https > 172.16.1.226.55518: Flags [F.], seq 77, ack 1, win 202, options [nop,nop,TS val 3639895444 ecr 915811281], length 0
14:25:43.423689 IP 172.16.1.226.55518 > xx-fbcdn-shv-01-iad3.fbcdn.net.https: Flags [F.], seq 1, ack 78, win 4096, options [nop,nop,TS val 915874710 ecr 3639895444], length 0
14:25:43.434353 IP xx-fbcdn-shv-01-iad3.fbcdn.net.https > 172.16.1.226.55518: Flags [.], ack 2, win 202, options [nop,nop,TS val 3639895457 ecr 915874708], length 0
14:25:43.435152 IP xx-fbcdn-shv-01-iad3.fbcdn.net.https > 172.16.1.226.55518: Flags [.], ack 2, win 202, options [nop,nop,TS val 3639895457 ecr 915874708], length 0
14:25:43.440646 IP xx-fbcdn-shv-01-iad3.fbcdn.net.https > 172.16.1.226.55518: Flags [.], ack 2, win 202, options [nop,nop,TS val 3639895463 ecr 915874709], length 0
14:25:43.440743 IP xx-fbcdn-shv-01-iad3.fbcdn.net.https > 172.16.1.226.55518: Flags [.], ack 2, win 202, options [nop,nop,TS val 3639895463 ecr 915874709], length 0
14:25:43.721033 IP qs-in-f189.1e100.net.https > 172.16.1.226.55005: Flags [P.], seq 843656193:843656252, ack 1692316154, win 332, options [nop,nop,TS val 2970726695 ecr 915847699], length 59
14:25:43.721091 IP 172.16.1.226.55005 > qs-in-f189.1e100.net.https: Flags [.], ack 59, win 4094, options [nop,nop,TS val 915875005 ecr 2970726695], length 0
14:25:43.722025 IP qs-in-f189.1e100.net.https > 172.16.1.226.55005: Flags [P.], seq 59:97, ack 1, win 332, options [nop,nop,TS val 2970726695 ecr 915847699], length 38
14:25:43.722029 IP qs-in-f189.1e100.net.https > 172.16.1.226.55005: Flags [P.], seq 97:143, ack 1, win 332, options [nop,nop,TS val 2970726695 ecr 915847699], length 46
14:25:43.722078 IP 172.16.1.226.55005 > qs-in-f189.1e100.net.https: Flags [.], ack 97, win 4094, options [nop,nop,TS val 915875005 ecr 2970726695], length 0
14:25:43.722100 IP 172.16.1.226.55005 > qs-in-f189.1e100.net.https: Flags [.], ack 143, win 4093, options [nop,nop,TS val 915875006 ecr 2970726695], length 0
14:25:43.722582 IP 172.16.1.226.55005 > qs-in-f189.1e100.net.https: Flags [P.], seq 1:47, ack 143, win 4096, options [nop,nop,TS val 915875006 ecr 2970726695], length 46
14:25:43.748396 IP qs-in-f189.1e100.net.https > 172.16.1.226.55005: Flags [.], ack 47, win 332, options [nop,nop,TS val 2970726761 ecr 915875006], length 0
14:25:43.986660 IP 172.16.1.226.52033 > 172.16.1.1.domain: 19406+ PTR? 228.69.13.31.in-addr.arpa. (43)
14:25:44.079366 IP 172.16.1.1.domain > 172.16.1.226.52033: 19406 1/6/6 PTR edge-star-mini-shv-01-iad3.facebook.com. (304)
14:25:45.393278 IP xx-fbcdn-shv-01-iad3.fbcdn.net.https > 172.16.1.226.55517: Flags [P.], seq 1398016465:1398016511, ack 1819435205, win 123, options [nop,nop,TS val 1103151219 ecr 915811829], length 46
14:25:45.393333 IP 172.16.1.226.55517 > xx-fbcdn-shv-01-iad3.fbcdn.net.https: Flags [.], ack 46, win 4094, options [nop,nop,TS val 915876675 ecr 1103151219], length 0
14:25:45.393778 IP 172.16.1.226.55517 > xx-fbcdn-shv-01-iad3.fbcdn.net.https: Flags [F.], seq 1, ack 46, win 4096, options [nop,nop,TS val 915876675 ecr 1103151219], length 0
14:25:45.395852 IP xx-fbcdn-shv-01-iad3.fbcdn.net.https > 172.16.1.226.55517: Flags [P.], seq 46:77, ack 1, win 123, options [nop,nop,TS val 1103151219 ecr 915811829], length 31
14:25:45.395929 IP 172.16.1.226.55517 > xx-fbcdn-shv-01-iad3.fbcdn.net.https: Flags [R], seq 1819435205, win 0, length 0
14:25:45.398230 IP xx-fbcdn-shv-01-iad3.fbcdn.net.https > 172.16.1.226.55517: Flags [F.], seq 77, ack 1, win 123, options [nop,nop,TS val 1103151219 ecr 915811829], length 0
14:25:45.398261 IP 172.16.1.226.55517 > xx-fbcdn-shv-01-iad3.fbcdn.net.https: Flags [R], seq 1819435205, win 0, length 0
14:25:45.398987 IP xx-fbcdn-shv-01-iad3.fbcdn.net.https > 172.16.1.226.55517: Flags [F.], seq 77, ack 1, win 123, options [nop,nop,TS val 1103151275 ecr 915811829], length 0
14:25:45.399018 IP 172.16.1.226.55517 > xx-fbcdn-shv-01-iad3.fbcdn.net.https: Flags [R], seq 1819435205, win 0, length 0
14:25:45.418333 IP xx-fbcdn-shv-01-iad3.fbcdn.net.https > 172.16.1.226.55517: Flags [.], ack 2, win 123, options [nop,nop,TS val 1103151355 ecr 915876675], length 0
14:25:45.418364 IP 172.16.1.226.55517 > xx-fbcdn-shv-01-iad3.fbcdn.net.https: Flags [R], seq 1819435206, win 0, length 0
14:25:48.431314 IP 172.16.1.226.55552 > ec2-52-70-0-168.compute-1.amazonaws.com.https: Flags [F.], seq 1863437548, ack 1547971713, win 4102, options [nop,nop,TS val 915879707 ecr 276298854], length 0
14:25:48.435467 IP 172.16.1.226.54999 > qs-in-f189.1e100.net.https: Flags [P.], seq 3856772070:3856772409, ack 440250325, win 4096, options [nop,nop,TS val 915879711 ecr 1931714318], length 339
14:25:48.444072 IP ec2-52-70-0-168.compute-1.amazonaws.com.https > 172.16.1.226.55552: Flags [P.], seq 1:32, ack 1, win 126, options [nop,nop,TS val 276313336 ecr 915879707], length 31
14:25:48.444110 IP 172.16.1.226.55552 > ec2-52-70-0-168.compute-1.amazonaws.com.https: Flags [R], seq 1863437549, win 0, length 0
14:25:48.445042 IP ec2-52-70-0-168.compute-1.amazonaws.com.https > 172.16.1.226.55552: Flags [F.], seq 32, ack 1, win 126, options [nop,nop,TS val 276313336 ecr 915879707], length 0
14:25:48.445052 IP 172.16.1.226.55552 > ec2-52-70-0-168.compute-1.amazonaws.com.https: Flags [R], seq 1863437549, win 0, length 0
14:25:48.458063 IP qs-in-f189.1e100.net.https > 172.16.1.226.54999: Flags [.], ack 339, win 255, options [nop,nop,TS val 1931772188 ecr 915879711], length 0
14:25:48.467150 IP qs-in-f189.1e100.net.https > 172.16.1.226.54999: Flags [P.], seq 1:237, ack 339, win 255, options [nop,nop,TS val 1931772198 ecr 915879711], length 236
14:25:48.467179 IP 172.16.1.226.54999 > qs-in-f189.1e100.net.https: Flags [.], ack 237, win 4088, options [nop,nop,TS val 915879741 ecr 1931772198], length 0
14:25:48.475428 IP qs-in-f189.1e100.net.https > 172.16.1.226.54999: Flags [P.], seq 237:474, ack 339, win 255, options [nop,nop,TS val 1931772207 ecr 915879711], length 237
14:25:48.475462 IP 172.16.1.226.54999 > qs-in-f189.1e100.net.https: Flags [.], ack 474, win 4088, options [nop,nop,TS val 915879749 ecr 1931772207], length 0
14:25:48.476413 IP qs-in-f189.1e100.net.https > 172.16.1.226.54999: Flags [P.], seq 474:529, ack 339, win 255, options [nop,nop,TS val 1931772207 ecr 915879711], length 55
14:25:48.476439 IP 172.16.1.226.54999 > qs-in-f189.1e100.net.https: Flags [.], ack 529, win 4094, options [nop,nop,TS val 915879749 ecr 1931772207], length 0
14:25:48.478497 IP qs-in-f189.1e100.net.https > 172.16.1.226.54999: Flags [P.], seq 529:575, ack 339, win 255, options [nop,nop,TS val 1931772207 ecr 915879711], length 46
14:25:48.478589 IP 172.16.1.226.54999 > qs-in-f189.1e100.net.https: Flags [.], ack 575, win 4094, options [nop,nop,TS val 915879752 ecr 1931772207], length 0
14:25:48.479683 IP 172.16.1.226.54999 > qs-in-f189.1e100.net.https: Flags [P.], seq 339:385, ack 575, win 4096, options [nop,nop,TS val 915879753 ecr 1931772207], length 46
14:25:48.493532 IP 172.16.1.226.55005 > qs-in-f189.1e100.net.https: Flags [P.], seq 47:971, ack 143, win 4096, options [nop,nop,TS val 915879766 ecr 2970726761], length 924
14:25:48.514305 IP qs-in-f189.1e100.net.https > 172.16.1.226.55005: Flags [.], ack 971, win 341, options [nop,nop,TS val 2970731528 ecr 915879766], length 0
14:25:48.539018 IP qs-in-f189.1e100.net.https > 172.16.1.226.54999: Flags [.], ack 385, win 255, options [nop,nop,TS val 1931772231 ecr 915879753], length 0
14:25:48.555028 IP qs-in-f189.1e100.net.https > 172.16.1.226.55005: Flags [P.], seq 143:356, ack 971, win 341, options [nop,nop,TS val 2970731568 ecr 915879766], length 213
14:25:48.555075 IP 172.16.1.226.55005 > qs-in-f189.1e100.net.https: Flags [.], ack 356, win 4089, options [nop,nop,TS val 915879826 ecr 2970731568], length 0
14:25:48.555898 IP qs-in-f189.1e100.net.https > 172.16.1.226.55005: Flags [P.], seq 356:415, ack 971, win 341, options [nop,nop,TS val 2970731569 ecr 915879766], length 59
14:25:48.555942 IP 172.16.1.226.55005 > qs-in-f189.1e100.net.https: Flags [.], ack 415, win 4094, options [nop,nop,TS val 915879826 ecr 2970731569], length 0
14:25:49.087844 IP 172.16.1.226.61732 > 172.16.1.1.domain: 22492+ PTR? 168.0.70.52.in-addr.arpa. (42)
14:25:49.181623 IP 172.16.1.1.domain > 172.16.1.226.61732: 22492 1/6/6 PTR ec2-52-70-0-168.compute-1.amazonaws.com. (303)
14:25:52.286089 IP 54.239.31.104.https > 172.16.1.226.55494: Flags [R.], seq 32913236, ack 603641258, win 9300, length 0
14:25:53.188275 IP 172.16.1.226.53829 > 172.16.1.1.domain: 41286+ PTR? 104.31.239.54.in-addr.arpa. (44)
14:25:53.330527 IP 172.16.1.1.domain > 172.16.1.226.53829: 41286 NXDomain 0/0/0 (44)
14:25:54.118718 IP 172.16.1.226.60708 > 172.16.1.1.domain: 33307+ A? api.run.pivotal.io. (36)
14:25:54.118884 IP 172.16.1.226.61437 > 172.16.1.1.domain: 41680+ AAAA? api.run.pivotal.io. (36)
14:25:54.176209 IP 172.16.1.1.domain > 172.16.1.226.60708: 33307 2/6/6 A 54.157.92.245, A 52.45.222.188 (276)
14:25:55.119288 IP 172.16.1.226.61437 > 172.16.1.1.domain: 41680+ AAAA? api.run.pivotal.io. (36)
14:25:56.300575 IP 172.16.1.226.55556 > ec2-54-157-92-245.compute-1.amazonaws.com.https: Flags [S], seq 566185248, win 65535, options [mss 1460,nop,wscale 5,nop,nop,TS val 915887564 ecr 0,sackOK,eol], length 0
14:25:56.314550 IP ec2-54-157-92-245.compute-1.amazonaws.com.https > 172.16.1.226.55556: Flags [S.], seq 1021796205, ack 566185249, win 28960, options [mss 1460,sackOK,TS val 103700945 ecr 915887564,nop,wscale 8], length 0
14:25:56.314604 IP 172.16.1.226.55556 > ec2-54-157-92-245.compute-1.amazonaws.com.https: Flags [.], ack 1, win 4117, options [nop,nop,TS val 915887578 ecr 103700945], length 0
14:25:56.315732 IP 172.16.1.226.55556 > ec2-54-157-92-245.compute-1.amazonaws.com.https: Flags [P.], seq 1:166, ack 1, win 4117, options [nop,nop,TS val 915887579 ecr 103700945], length 165
14:25:56.331229 IP ec2-54-157-92-245.compute-1.amazonaws.com.https > 172.16.1.226.55556: Flags [.], ack 166, win 118, options [nop,nop,TS val 103700949 ecr 915887579], length 0
14:25:56.334317 IP ec2-54-157-92-245.compute-1.amazonaws.com.https > 172.16.1.226.55556: Flags [.], seq 1:1449, ack 166, win 118, options [nop,nop,TS val 103700950 ecr 915887579], length 1448
14:25:56.334960 IP 172.16.1.226.56798 > 172.16.1.1.domain: 19364+ PTR? 245.92.157.54.in-addr.arpa. (44)
14:25:56.335344 IP ec2-54-157-92-245.compute-1.amazonaws.com.https > 172.16.1.226.55556: Flags [.], seq 1449:2897, ack 166, win 118, options [nop,nop,TS val 103700950 ecr 915887579], length 1448
14:25:56.335386 IP 172.16.1.226.55556 > ec2-54-157-92-245.compute-1.amazonaws.com.https: Flags [.], ack 2897, win 4050, options [nop,nop,TS val 915887597 ecr 103700950], length 0
14:25:56.336673 IP ec2-54-157-92-245.compute-1.amazonaws.com.https > 172.16.1.226.55556: Flags [P.], seq 2897:3660, ack 166, win 118, options [nop,nop,TS val 103700950 ecr 915887579], length 763
14:25:56.336715 IP 172.16.1.226.55556 > ec2-54-157-92-245.compute-1.amazonaws.com.https: Flags [.], ack 3660, win 4072, options [nop,nop,TS val 915887598 ecr 103700950], length 0
14:25:56.415743 IP 172.16.1.226.55556 > ec2-54-157-92-245.compute-1.amazonaws.com.https: Flags [P.], seq 166:292, ack 3660, win 4096, options [nop,nop,TS val 915887676 ecr 103700950], length 126
14:25:56.430321 IP 172.16.1.1.domain > 172.16.1.226.56798: 19364 1/6/6 PTR ec2-54-157-92-245.compute-1.amazonaws.com. (307)
14:25:56.430981 IP ec2-54-157-92-245.compute-1.amazonaws.com.https > 172.16.1.226.55556: Flags [P.], seq 3660:3711, ack 292, win 118, options [nop,nop,TS val 103700974 ecr 915887676], length 51
14:25:56.431015 IP 172.16.1.226.55556 > ec2-54-157-92-245.compute-1.amazonaws.com.https: Flags [.], ack 3711, win 4094, options [nop,nop,TS val 915887691 ecr 103700974], length 0
14:25:56.431320 IP 172.16.1.226.55556 > ec2-54-157-92-245.compute-1.amazonaws.com.https: Flags [P.], seq 292:529, ack 3711, win 4096, options [nop,nop,TS val 915887691 ecr 103700974], length 237
14:25:56.477362 IP 172.16.1.226.55556 > ec2-54-157-92-245.compute-1.amazonaws.com.https: Flags [P.], seq 292:529, ack 3711, win 4096, options [nop,nop,TS val 915887736 ecr 103700974], length 237
14:25:56.479390 IP ec2-54-157-92-245.compute-1.amazonaws.com.https > 172.16.1.226.55556: Flags [P.], seq 3711:4624, ack 529, win 122, options [nop,nop,TS val 103700986 ecr 915887691], length 913
14:25:56.479446 IP 172.16.1.226.55556 > ec2-54-157-92-245.compute-1.amazonaws.com.https: Flags [.], ack 4624, win 4067, options [nop,nop,TS val 915887738 ecr 103700986], length 0
14:25:56.479737 IP 172.16.1.226.55556 > ec2-54-157-92-245.compute-1.amazonaws.com.https: Flags [P.], seq 529:560, ack 4624, win 4096, options [nop,nop,TS val 915887738 ecr 103700986], length 31
14:25:56.479789 IP 172.16.1.226.55556 > ec2-54-157-92-245.compute-1.amazonaws.com.https: Flags [F.], seq 560, ack 4624, win 4096, options [nop,nop,TS val 915887738 ecr 103700986], length 0
14:25:56.480218 IP ec2-54-157-92-245.compute-1.amazonaws.com.https > 172.16.1.226.55556: Flags [P.], seq 4624:4655, ack 529, win 122, options [nop,nop,TS val 103700986 ecr 915887691], length 31
14:25:56.480289 IP 172.16.1.226.55556 > ec2-54-157-92-245.compute-1.amazonaws.com.https: Flags [R], seq 566185777, win 0, length 0
14:25:56.488761 IP 172.16.1.226.60912 > 172.16.1.1.domain: 31140+ A? login.run.pivotal.io. (38)
14:25:56.489242 IP 172.16.1.226.65417 > 172.16.1.1.domain: 17353+ AAAA? login.run.pivotal.io. (38)
14:25:56.495257 IP ec2-54-157-92-245.compute-1.amazonaws.com.https > 172.16.1.226.55556: Flags [.], ack 529, win 122, options [nop,nop,TS val 103700990 ecr 915887736,nop,nop,sack 1 {292:529}], length 0
14:25:56.495287 IP 172.16.1.226.55556 > ec2-54-157-92-245.compute-1.amazonaws.com.https: Flags [R], seq 566185777, win 0, length 0
14:25:56.496293 IP ec2-54-157-92-245.compute-1.amazonaws.com.https > 172.16.1.226.55556: Flags [.], ack 560, win 122, options [nop,nop,TS val 103700990 ecr 915887738], length 0
14:25:56.496325 IP 172.16.1.226.55556 > ec2-54-157-92-245.compute-1.amazonaws.com.https: Flags [R], seq 566185808, win 0, length 0
14:25:56.496793 IP ec2-54-157-92-245.compute-1.amazonaws.com.https > 172.16.1.226.55556: Flags [F.], seq 4655, ack 561, win 122, options [nop,nop,TS val 103700990 ecr 915887738], length 0
14:25:56.496824 IP 172.16.1.226.55556 > ec2-54-157-92-245.compute-1.amazonaws.com.https: Flags [R], seq 566185809, win 0, length 0
14:25:56.595947 IP 172.16.1.1.domain > 172.16.1.226.60912: 31140 2/6/6 A 52.45.222.188, A 54.157.92.245 (278)
14:25:57.491915 IP 172.16.1.226.65417 > 172.16.1.1.domain: 17353+ AAAA? login.run.pivotal.io. (38)
14:25:58.818936 IP 172.16.1.226.55557 > ec2-52-45-222-188.compute-1.amazonaws.com.https: Flags [S], seq 2868284400, win 65535, options [mss 1460,nop,wscale 5,nop,nop,TS val 915890072 ecr 0,sackOK,eol], length 0
14:25:58.834798 IP ec2-52-45-222-188.compute-1.amazonaws.com.https > 172.16.1.226.55557: Flags [S.], seq 2514469295, ack 2868284401, win 28960, options [mss 1460,sackOK,TS val 179883082 ecr 915890072,nop,wscale 8], length 0
14:25:58.834859 IP 172.16.1.226.55557 > ec2-52-45-222-188.compute-1.amazonaws.com.https: Flags [.], ack 1, win 4117, options [nop,nop,TS val 915890088 ecr 179883082], length 0
14:25:58.835160 IP 172.16.1.226.55557 > ec2-52-45-222-188.compute-1.amazonaws.com.https: Flags [P.], seq 1:168, ack 1, win 4117, options [nop,nop,TS val 915890088 ecr 179883082], length 167
14:25:58.853578 IP ec2-52-45-222-188.compute-1.amazonaws.com.https > 172.16.1.226.55557: Flags [.], ack 168, win 118, options [nop,nop,TS val 179883086 ecr 915890088], length 0
14:25:58.855456 IP ec2-52-45-222-188.compute-1.amazonaws.com.https > 172.16.1.226.55557: Flags [.], seq 1:1449, ack 168, win 118, options [nop,nop,TS val 179883087 ecr 915890088], length 1448
14:25:58.857904 IP ec2-52-45-222-188.compute-1.amazonaws.com.https > 172.16.1.226.55557: Flags [.], seq 1449:2897, ack 168, win 118, options [nop,nop,TS val 179883087 ecr 915890088], length 1448
14:25:58.857945 IP 172.16.1.226.55557 > ec2-52-45-222-188.compute-1.amazonaws.com.https: Flags [.], ack 2897, win 4050, options [nop,nop,TS val 915890109 ecr 179883087], length 0
14:25:58.859936 IP ec2-52-45-222-188.compute-1.amazonaws.com.https > 172.16.1.226.55557: Flags [P.], seq 2897:3660, ack 168, win 118, options [nop,nop,TS val 179883087 ecr 915890088], length 763
14:25:58.859977 IP 172.16.1.226.55557 > ec2-52-45-222-188.compute-1.amazonaws.com.https: Flags [.], ack 3660, win 4072, options [nop,nop,TS val 915890111 ecr 179883087], length 0
14:25:58.861657 IP 172.16.1.226.55557 > ec2-52-45-222-188.compute-1.amazonaws.com.https: Flags [P.], seq 168:294, ack 3660, win 4096, options [nop,nop,TS val 915890112 ecr 179883087], length 126
14:25:58.883391 IP ec2-52-45-222-188.compute-1.amazonaws.com.https > 172.16.1.226.55557: Flags [.], ack 294, win 118, options [nop,nop,TS val 179883093 ecr 915890112], length 0
14:25:58.885067 IP ec2-52-45-222-188.compute-1.amazonaws.com.https > 172.16.1.226.55557: Flags [P.], seq 3660:3711, ack 294, win 118, options [nop,nop,TS val 179883094 ecr 915890112], length 51
14:25:58.885113 IP 172.16.1.226.55557 > ec2-52-45-222-188.compute-1.amazonaws.com.https: Flags [.], ack 3711, win 4094, options [nop,nop,TS val 915890134 ecr 179883094], length 0
14:25:58.885492 IP 172.16.1.226.55557 > ec2-52-45-222-188.compute-1.amazonaws.com.https: Flags [P.], seq 294:531, ack 3711, win 4096, options [nop,nop,TS val 915890134 ecr 179883094], length 237
14:25:58.940532 IP ec2-52-45-222-188.compute-1.amazonaws.com.https > 172.16.1.226.55557: Flags [P.], seq 3711:4784, ack 531, win 122, options [nop,nop,TS val 179883108 ecr 915890134], length 1073
14:25:58.940579 IP 172.16.1.226.55557 > ec2-52-45-222-188.compute-1.amazonaws.com.https: Flags [.], ack 4784, win 4062, options [nop,nop,TS val 915890189 ecr 179883108], length 0
14:25:58.940832 IP 172.16.1.226.55557 > ec2-52-45-222-188.compute-1.amazonaws.com.https: Flags [P.], seq 531:562, ack 4784, win 4096, options [nop,nop,TS val 915890189 ecr 179883108], length 31
14:25:58.940889 IP 172.16.1.226.55557 > ec2-52-45-222-188.compute-1.amazonaws.com.https: Flags [F.], seq 562, ack 4784, win 4096, options [nop,nop,TS val 915890189 ecr 179883108], length 0
14:25:58.940934 IP ec2-52-45-222-188.compute-1.amazonaws.com.https > 172.16.1.226.55557: Flags [P.], seq 4784:4815, ack 531, win 122, options [nop,nop,TS val 179883108 ecr 915890134], length 31
14:25:58.941039 IP 172.16.1.226.55557 > ec2-52-45-222-188.compute-1.amazonaws.com.https: Flags [R], seq 2868284931, win 0, length 0
14:25:58.956207 IP ec2-52-45-222-188.compute-1.amazonaws.com.https > 172.16.1.226.55557: Flags [F.], seq 4815, ack 562, win 122, options [nop,nop,TS val 179883112 ecr 915890189], length 0
14:25:58.956238 IP 172.16.1.226.55557 > ec2-52-45-222-188.compute-1.amazonaws.com.https: Flags [R], seq 2868284962, win 0, length 0
14:25:58.984962 IP ec2-52-45-222-188.compute-1.amazonaws.com.https > 172.16.1.226.55557: Flags [.], ack 563, win 122, options [nop,nop,TS val 179883119 ecr 915890189], length 0
14:25:58.984984 IP 172.16.1.226.55557 > ec2-52-45-222-188.compute-1.amazonaws.com.https: Flags [R], seq 2868284963, win 0, length 0
14:25:59.435181 IP 172.16.1.226.57163 > 172.16.1.1.domain: 56132+ PTR? 188.222.45.52.in-addr.arpa. (44)
14:25:59.454400 IP 172.16.1.1.domain > 172.16.1.226.57163: 56132 1/6/6 PTR ec2-52-45-222-188.compute-1.amazonaws.com. (307)
14:26:04.193502 IP 172.16.1.1.64872 > 172.16.1.226.61437: UDP, length 36
14:26:04.193532 IP 172.16.1.226 > 172.16.1.1: ICMP 172.16.1.226 udp port 61437 unreachable, length 36
14:26:06.596802 IP 172.16.1.1.domain > 172.16.1.226.65417: 17353 ServFail 0/0/0 (38)
14:26:06.596830 IP 172.16.1.226 > 172.16.1.1: ICMP 172.16.1.226 udp port 65417 unreachable, length 36
14:26:10.353861 IP 172.16.1.226.52943 > 172.16.1.1.domain: 21599+ A? docs.google.com. (33)
14:26:10.445955 IP 172.16.1.1.domain > 172.16.1.226.52943: 21599 1/4/4 A 216.58.194.206 (185)
14:26:10.447147 IP 172.16.1.226.55558 > sfo03s01-in-f14.1e100.net.https: Flags [S], seq 1265639297, win 65535, options [mss 1460,nop,wscale 5,nop,nop,TS val 915901688 ecr 0,sackOK,eol], length 0
14:26:10.469096 IP 172.16.1.226.50867 > 172.16.1.1.domain: 62318+ PTR? 206.194.58.216.in-addr.arpa. (45)
14:26:10.493390 IP 172.16.1.1.domain > 172.16.1.226.50867: 62318 2/6/5 PTR sfo03s01-in-f14.1e100.net., PTR sfo03s01-in-f206.1e100.net. (312)
14:26:10.529176 IP sfo03s01-in-f14.1e100.net.https > 172.16.1.226.55558: Flags [S.], seq 3205223442, ack 1265639298, win 42408, options [mss 1380,sackOK,TS val 3246412252 ecr 915901688,nop,wscale 8], length 0
14:26:10.529260 IP 172.16.1.226.55558 > sfo03s01-in-f14.1e100.net.https: Flags [.], ack 1, win 4104, options [nop,nop,TS val 915901770 ecr 3246412252], length 0
14:26:10.530213 IP 172.16.1.226.55558 > sfo03s01-in-f14.1e100.net.https: Flags [P.], seq 1:258, ack 1, win 4104, options [nop,nop,TS val 915901770 ecr 3246412252], length 257
14:26:10.615612 IP sfo03s01-in-f14.1e100.net.https > 172.16.1.226.55558: Flags [.], ack 258, win 170, options [nop,nop,TS val 3246412339 ecr 915901770], length 0
14:26:10.634263 IP sfo03s01-in-f14.1e100.net.https > 172.16.1.226.55558: Flags [.], seq 1:1419, ack 258, win 170, options [nop,nop,TS val 3246412357 ecr 915901770], length 1418
14:26:10.635289 IP sfo03s01-in-f14.1e100.net.https > 172.16.1.226.55558: Flags [.], seq 1419:2837, ack 258, win 170, options [nop,nop,TS val 3246412357 ecr 915901770], length 1418
14:26:10.635338 IP 172.16.1.226.55558 > sfo03s01-in-f14.1e100.net.https: Flags [.], ack 2837, win 4051, options [nop,nop,TS val 915901875 ecr 3246412357], length 0
14:26:10.635633 IP sfo03s01-in-f14.1e100.net.https > 172.16.1.226.55558: Flags [P.], seq 2837:3591, ack 258, win 170, options [nop,nop,TS val 3246412357 ecr 915901770], length 754
14:26:10.635672 IP 172.16.1.226.55558 > sfo03s01-in-f14.1e100.net.https: Flags [.], ack 3591, win 4072, options [nop,nop,TS val 915901875 ecr 3246412357], length 0
14:26:10.660880 IP 172.16.1.226.55558 > sfo03s01-in-f14.1e100.net.https: Flags [P.], seq 258:333, ack 3591, win 4096, options [nop,nop,TS val 915901900 ecr 3246412357], length 75
14:26:10.660894 IP 172.16.1.226.55558 > sfo03s01-in-f14.1e100.net.https: Flags [P.], seq 333:339, ack 3591, win 4096, options [nop,nop,TS val 915901900 ecr 3246412357], length 6
14:26:10.660903 IP 172.16.1.226.55558 > sfo03s01-in-f14.1e100.net.https: Flags [P.], seq 339:384, ack 3591, win 4096, options [nop,nop,TS val 915901900 ecr 3246412357], length 45
14:26:10.747784 IP sfo03s01-in-f14.1e100.net.https > 172.16.1.226.55558: Flags [.], ack 384, win 170, options [nop,nop,TS val 3246412471 ecr 915901900], length 0
14:26:10.748547 IP sfo03s01-in-f14.1e100.net.https > 172.16.1.226.55558: Flags [P.], seq 3591:3642, ack 384, win 170, options [nop,nop,TS val 3246412471 ecr 915901900], length 51
14:26:10.748596 IP 172.16.1.226.55558 > sfo03s01-in-f14.1e100.net.https: Flags [.], ack 3642, win 4094, options [nop,nop,TS val 915901986 ecr 3246412471], length 0
14:26:10.748901 IP sfo03s01-in-f14.1e100.net.https > 172.16.1.226.55558: Flags [P.], seq 3642:3711, ack 384, win 170, options [nop,nop,TS val 3246412471 ecr 915901900], length 69
14:26:10.748942 IP 172.16.1.226.55558 > sfo03s01-in-f14.1e100.net.https: Flags [.], ack 3711, win 4093, options [nop,nop,TS val 915901987 ecr 3246412471], length 0
14:26:10.751591 IP 172.16.1.226.55558 > sfo03s01-in-f14.1e100.net.https: Flags [P.], seq 384:437, ack 3711, win 4096, options [nop,nop,TS val 915901989 ecr 3246412471], length 53
14:26:10.751684 IP 172.16.1.226.55558 > sfo03s01-in-f14.1e100.net.https: Flags [P.], seq 437:487, ack 3711, win 4096, options [nop,nop,TS val 915901989 ecr 3246412471], length 50
14:26:10.751865 IP 172.16.1.226.55558 > sfo03s01-in-f14.1e100.net.https: Flags [P.], seq 487:529, ack 3711, win 4096, options [nop,nop,TS val 915901989 ecr 3246412471], length 42
14:26:10.751958 IP 172.16.1.226.55558 > sfo03s01-in-f14.1e100.net.https: Flags [P.], seq 529:1636, ack 3711, win 4096, options [nop,nop,TS val 915901989 ecr 3246412471], length 1107
14:26:10.752041 IP 172.16.1.226.55558 > sfo03s01-in-f14.1e100.net.https: Flags [.], seq 1636:3004, ack 3711, win 4096, options [nop,nop,TS val 915901989 ecr 3246412471], length 1368
14:26:10.752065 IP 172.16.1.226.55558 > sfo03s01-in-f14.1e100.net.https: Flags [.], seq 3004:4372, ack 3711, win 4096, options [nop,nop,TS val 915901989 ecr 3246412471], length 1368
14:26:10.752075 IP 172.16.1.226.55558 > sfo03s01-in-f14.1e100.net.https: Flags [P.], seq 4372:4625, ack 3711, win 4096, options [nop,nop,TS val 915901989 ecr 3246412471], length 253
14:26:10.752240 IP 172.16.1.226.55558 > sfo03s01-in-f14.1e100.net.https: Flags [P.], seq 4625:4663, ack 3711, win 4096, options [nop,nop,TS val 915901989 ecr 3246412471], length 38
14:26:10.835699 IP sfo03s01-in-f14.1e100.net.https > 172.16.1.226.55558: Flags [.], ack 529, win 170, options [nop,nop,TS val 3246412559 ecr 915901989], length 0
14:26:10.835702 IP sfo03s01-in-f14.1e100.net.https > 172.16.1.226.55558: Flags [.], ack 529, win 181, options [nop,nop,TS val 3246412559 ecr 915901989,nop,nop,sack 1 {1636:3004}], length 0
14:26:10.835704 IP sfo03s01-in-f14.1e100.net.https > 172.16.1.226.55558: Flags [P.], seq 3711:3749, ack 529, win 181, options [nop,nop,TS val 3246412559 ecr 915901989,nop,nop,sack 1 {1636:3004}], length 38
14:26:10.835767 IP 172.16.1.226.55558 > sfo03s01-in-f14.1e100.net.https: Flags [.], ack 3749, win 4094, options [nop,nop,TS val 915902073 ecr 3246412559], length 0
14:26:10.836621 IP sfo03s01-in-f14.1e100.net.https > 172.16.1.226.55558: Flags [.], ack 529, win 192, options [nop,nop,TS val 3246412559 ecr 915901989,nop,nop,sack 1 {1636:4372}], length 0
14:26:10.836664 IP 172.16.1.226.55558 > sfo03s01-in-f14.1e100.net.https: Flags [.], seq 529:1636, ack 3749, win 4096, options [nop,nop,TS val 915902073 ecr 3246412559], length 1107
14:26:10.836679 IP 172.16.1.226.55558 > sfo03s01-in-f14.1e100.net.https: Flags [P.], seq 4402:4663, ack 3749, win 4096, options [nop,nop,TS val 915902073 ecr 3246412559], length 261
14:26:10.859213 IP sfo03s01-in-f14.1e100.net.https > 172.16.1.226.55558: Flags [.], ack 529, win 196, options [nop,nop,TS val 3246412583 ecr 915901989,nop,nop,sack 1 {1636:4625}], length 0
14:26:10.864185 IP sfo03s01-in-f14.1e100.net.https > 172.16.1.226.55558: Flags [.], ack 529, win 200, options [nop,nop,TS val 3246412587 ecr 915901989,nop,nop,sack 1 {1636:4663}], length 0
14:26:10.922625 IP sfo03s01-in-f14.1e100.net.https > 172.16.1.226.55558: Flags [.], ack 4663, win 209, options [nop,nop,TS val 3246412646 ecr 915902073], length 0
14:26:11.089024 IP sfo03s01-in-f14.1e100.net.https > 172.16.1.226.55558: Flags [P.], seq 3749:4144, ack 4663, win 209, options [nop,nop,TS val 3246412764 ecr 915902073], length 395
14:26:11.089028 IP sfo03s01-in-f14.1e100.net.https > 172.16.1.226.55558: Flags [P.], seq 4144:4182, ack 4663, win 209, options [nop,nop,TS val 3246412768 ecr 915902073], length 38
14:26:11.089077 IP 172.16.1.226.55558 > sfo03s01-in-f14.1e100.net.https: Flags [.], ack 4144, win 4083, options [nop,nop,TS val 915902322 ecr 3246412764], length 0
14:26:11.089098 IP 172.16.1.226.55558 > sfo03s01-in-f14.1e100.net.https: Flags [.], ack 4182, win 4082, options [nop,nop,TS val 915902322 ecr 3246412768], length 0
14:26:11.090248 IP sfo03s01-in-f14.1e100.net.https > 172.16.1.226.55558: Flags [P.], seq 4182:4228, ack 4663, win 209, options [nop,nop,TS val 3246412768 ecr 915902073], length 46
14:26:11.090300 IP 172.16.1.226.55558 > sfo03s01-in-f14.1e100.net.https: Flags [.], ack 4228, win 4094, options [nop,nop,TS val 915902323 ecr 3246412768], length 0
14:26:11.090555 IP 172.16.1.226.55558 > sfo03s01-in-f14.1e100.net.https: Flags [P.], seq 4663:4709, ack 4228, win 4096, options [nop,nop,TS val 915902323 ecr 3246412768], length 46
14:26:11.174868 IP sfo03s01-in-f14.1e100.net.https > 172.16.1.226.55558: Flags [.], ack 4709, win 209, options [nop,nop,TS val 3246412897 ecr 915902323], length 0
14:26:17.869938 IP 172.16.1.226.63480 > 172.16.1.1.domain: 54480+ AAAA? login.run.pivotal.io. (38)
14:26:18.085517 IP qs-in-f189.1e100.net.https > 172.16.1.226.55005: Flags [P.], seq 415:474, ack 971, win 341, options [nop,nop,TS val 2970761050 ecr 915879826], length 59
14:26:18.085577 IP 172.16.1.226.55005 > qs-in-f189.1e100.net.https: Flags [.], ack 474, win 4094, options [nop,nop,TS val 915909313 ecr 2970761050], length 0
14:26:18.872730 IP 172.16.1.226.63480 > 172.16.1.1.domain: 54480+ AAAA? login.run.pivotal.io. (38)
14:26:20.876015 IP 172.16.1.226.63480 > ec2-50-18-198-228.us-west-1.compute.amazonaws.com.domain: 54480+ AAAA? login.run.pivotal.io. (38)
14:26:21.508070 IP 172.16.1.226.65218 > ec2-50-18-198-228.us-west-1.compute.amazonaws.com.domain: 36789+ PTR? 228.198.18.50.in-addr.arpa. (44)
14:26:21.597895 IP ec2-50-18-198-228.us-west-1.compute.amazonaws.com.domain > 172.16.1.226.65218: 36789 1/6/6 PTR ec2-50-18-198-228.us-west-1.compute.amazonaws.com. (315)
14:26:21.876995 IP 172.16.1.226.63480 > ec2-50-18-198-228.us-west-1.compute.amazonaws.com.domain: 54480+ AAAA? login.run.pivotal.io. (38)
